Vol,Year,Title,题目,网址
114-110,2019-2018,Acoustic monitoring of a thermo-mechanical test simulating withdrawal in a gas storage salt cavern,声学监测热机械试验模拟在储气盐洞中的撤离,/science/article/pii/S1365160917307116/pdfft?md5=edb15b37b25fbe6ccc9ed551b2ea0d5a&pid=1-s2.0-S1365160917307116-main.pdf
114-110,2019-2018,A new approach to quantify the anisotropy of hydromechanical strains in clay-rock at the gallery scale,一种量化粘土岩中流体力学应变各向异性的新方法,/science/article/pii/S1365160917312236/pdfft?md5=6215d972b9fcaa9bc5c637544d61d30e&pid=1-s2.0-S1365160917312236-main.pdf
114-110,2019-2018,Mechanical behavior of salt rock under uniaxial compression and creep tests,单轴压缩和蠕变试验下盐岩的力学行为,/science/article/pii/S1365160917309668/pdfft?md5=baf06656139bfd193f48a5e45a391fa1&pid=1-s2.0-S1365160917309668-main.pdf
114-110,2019-2018,Semi-automatic extraction of rock discontinuities from point clouds using the ISODATA clustering algorithm and deviation from mean elevation,使用ISODATA聚类算法从平面云中半自动提取岩石不连续性并偏离平均海拔,/science/article/pii/S1365160917307281/pdfft?md5=badf98c7e8b6198f970938bb0fa03418&pid=1-s2.0-S1365160917307281-main.pdf
114-110,2019-2018,Development and evaluation of artificial expandable pillars for hard rock mining,硬岩开采人工可膨胀支柱的开发与评价,/science/article/pii/S1365160918302594/pdfft?md5=b5c64641922527da53972ec85ea310c6&pid=1-s2.0-S1365160918302594-main.pdf
114-110,2019-2018,Three-dimensional bonded-particle discrete element modeling of mechanical behavior of transversely isotropic rock,横观各向同性岩石力学特性的三维粘粒子离散元模型,/science/article/pii/S1365160917305567/pdfft?md5=072764a0df8a5d9c5a6f11a08a272192&pid=1-s2.0-S1365160917305567-main.pdf
114-110,2019-2018,Rockburst mechanism and prediction based on microseismic monitoring,基于微震监测的岩爆机理与预测,/science/article/pii/S136516091630507X/pdfft?md5=db615c9736b0b7498b0596ab344ee84c&pid=1-s2.0-S136516091630507X-main.pdf
114-110,2019-2018,Far field poroelastic response of geothermal reservoirs to hydraulic stimulation treatment: Theory and application at the Gro08 Sch02nebeck geothermal research facility,地热储层对水力增产处理的远场多孔弹性响应：Gro08Sch02nebeck地热研究设施的理论与应用,/science/article/pii/S1365160918303587/pdfft?md5=81cd23c561fbb16022394d3e6ccb3579&pid=1-s2.0-S1365160918303587-main.pdf
114-110,2019-2018,Computational framework for simulating rock burst in shear and compression,模拟剪切和压缩岩爆的计算框架,/science/article/pii/S1365160917310018/pdfft?md5=dbc074e38afe30cbe3ed180d2393be04&pid=1-s2.0-S1365160917310018-main.pdf
114-110,2019-2018,Charge design scheme optimization for ring blasting based on the developed Scaled Heelan model,基于Scaled Heelan模型的环形爆破装药设计方案优化,/science/article/pii/S1365160917308924/pdfft?md5=f4fc7fc2dbf28e584b8a0faa5726529d&pid=1-s2.0-S1365160917308924-main.pdf
114-110,2019-2018,Editorial Board,编委会,/science/article/pii/S1365160918308554/pdfft?md5=3ab16c83144c9a8efb8e3299236d548c&pid=1-s2.0-S1365160918308554-main.pdf
114-110,2019-2018,A new and unified approach to improved scalability and volumetric fracture intensity quantification for GSI and rockmass strength and deformability estimation,一种新的统一方法，用于改进GSI的可扩展性和体积破裂强度量化以及岩体强度和变形性评估,/science/article/pii/S1365160917312753/pdfft?md5=f5d2fa3d3700905e48e07e5192b28b48&pid=1-s2.0-S1365160917312753-main.pdf
114-110,2019-2018,Comprehensive stability analysis of an inclined wellbore embedded in Colorado shale formation for thermal recovery,作者：郝建军，王建华，王建华，岩土力学ROCK,/science/article/pii/S1365160917312261/pdfft?md5=fb9e72ec6ff81efb797a4399660f2cb7&pid=1-s2.0-S1365160917312261-main.pdf
114-110,2019-2018,Micro-damage evolution and macro-mechanical property degradation of limestone due to chemical effects,化学作用引起的石灰岩微损伤演化和宏观力学性能退化,/science/article/pii/S1365160917310146/pdfft?md5=906f410c55ff93146e523c2bc20c1ec0&pid=1-s2.0-S1365160917310146-main.pdf
114-110,2019-2018,Experimental investigation on fracture propagation modes in supercritical carbon dioxide fracturing using acoustic emission monitoring,超声二氧化碳压裂裂缝扩展模式的声发射监测实验研究,/science/article/pii/S1365160917312352/pdfft?md5=edd6b42452010f42a3c19ca18c94b300&pid=1-s2.0-S1365160917312352-main.pdf
